{
  "Path": "/example/",
  "UserName": "example-user",
  "UserId": "AKIAIOSFODNN7EXAMPLE",
  "Arn": "arn:aws:iam::123456789012:role/ExampleRole",
  "CreateDate": "2025-03-15T14:30:00Z",
  "PasswordLastUsed": "2025-03-15T14:30:00Z",
  "PermissionsBoundary": {
    "PermissionsBoundaryType": "PermissionsBoundaryPolicy",
    "PermissionsBoundaryArn": "arn:aws:iam::123456789012:role/ExampleRole"
  },
  "Tags": [
    {
      "Key": "example-value",
      "Value": "example-value"
    },
    {
      "Key": "example-value",
      "Value": "example-value"
    }
  ]
}